id,year,title,presenters,description,talk_dt,location
1,2017,5 ways to deploy your Python web app in 2017,Andrew T. Baker,You’ve built a fine Python web application and now you’re ready to share it with the world. But what’s the best way to deploy your app in 2017?  This talk will demonstrate popular techniques for deploying Python web applications. We’ll start with a simple Flask application and expose it to the world five times over as we learn to use different tools and services available to the modern Python developer.  Specific topics covered include:   Exposing your local dev environment with ngrok Using a Platform-as-a-Service (PaaS) like Heroku Going “serverless” with AWS Lambda Configuring your own VM with Google Compute Engine Thinking inside the box using Docker   We’ll also briefly touch on the pros and cons of each technique to help you figure out which one is right for your app.  At the end of this talk you will have a basic understanding of how each of these techniques work and you’ll be ready to try them out yourself.,2017-05-08 15:15:00,Portland Ballroom 252–253
2,2017,A gentle introduction to deep learning with TensorFlow,Michelle Fullwood,"Deep learning's explosion of spectacular results over the past few years may make it appear esoteric and daunting, but in reality, if you are familiar with traditional machine learning, you're more than ready to start exploring deep learning. This talk aims to gently bridge the divide by demonstrating how deep learning operates on core machine learning concepts and getting attendees started coding deep neural networks using Google's TensorFlow library.",2017-05-08 16:15:00,Oregon Ballroom 203–204
3,2017,aiosmtpd - A better asyncio based SMTP server,Barry Warsaw,"smtpd.py has been in the standard library for many years.  It's been a common tool for deploying SMTP and LMTP servers that handle email-based communication in Python, providing both basic protocol implementations and a fundamental module for higher level tools, such as lazr.smtptest for testing email clients.  Based on asyncore and asynchat, smtpd.py is showing its age, and its API is unwieldy.  Fortunately, there's a new alternative available.  aiosmtpd is a modern reinvention based on asyncio, with all the improvements that come along with such a new implementation.  It provides servers for both the SMTP and LMTP protocols, as well as a higher level ""controller"" API for testing SMTP and LMTP clients.  It exposes a much better API for customization, allowing the user to associate a simple ""handler"" to process incoming messages without having to worry about the details of the protocols, and it provides some useful hooks for subclassing.  This talk will describe the purpose and history of smtpd.py and aiosmtpd, show how users can extend the servers and implement specialized handlers, and show how applications can use the testing API for ensuring that their email sending applications do the right things.  Examples will be taken from GNU Mailman 3, which uses aiosmtpd extensively.",2017-05-08 14:30:00,Oregon Ballroom 203–204
4,2017,Algorithmic Music Generation,Padmaja V Bhagwat,"Music is mainly an artistic act of inspired creation and is unlike some of the traditional math problems.  Music cannot be solved by a simple set of formulae. The most interesting and challenging part is producing unique music without infringing the copyright. The generated music has to sound good, and what sounds good is very subjective and varies from culture to culture.  Artificial Neural Network/Deep Learning has a wide range of applications, such as in Image processing, Natural language processing, Time series prediction, etc. But what about its usage in art? Could we use deep learning to create music?   This talk is about how deep learning models were used to produce music - catering particularly to Bollywood.  This talk would show how an exquisite piece of art i.e. music can be generated using deep learning model which helps in automated feature extraction. In order to automate the music generation, the model must be able to remember the learned features over the longer period of time, this is achieved by a special type of Recurrent Neural Network (RNN) called as LSTM (Long Short Term Memory) network.   Implementation of such complex model can be made much easier using inbuilt Python libraries such as Keras with Theano as backend. It allows for easy and fast prototyping. Packages like numpy and scipy are being used for easier mathematical computation of input vectors and for reading/writing the WAV files respectively. The neural network architecture makes use of numerous amount of music samples to train the model. After an adequate number of iterations and training time, this model generates music that is unique and original.   In this talk, steps involved in preprocessing of data, training the model, testing the model and generating the music from the trained model will be discussed. This talk will also cover some of the challenges and tradeoffs made for algorithmic music generation.",2017-05-08 17:10:00,Portland Ballroom 251 & 258
5,2017,An Introduction to Reinforcement Learning,Jessica Forde,"Reinforcement learning (RL) is a subfield of machine learning focused on building agents: software that can robustly achieve a desired objective under varying states of the world. This introduction will provide you with an overview of RL and tools to build your own agents.  In this talk, we will provide an overview of terminology in reinforcement learning and a Jupyter Notebook outlining basic algorithms to learn 'policies', strategies for an agent, and visualize them with numpy, pandas, and seaborn.  Newer developments in reinforcement learning apply deep learning to improve performance.  We will further discuss deep reinforcement learning and how to use deep learning libraries, such as TensorFlow or Theano, with the latest RL libraries: OpenAI Gym, OpenAI Universe, and DeepMind Lab.",2017-05-08 13:40:00,Portland Ballroom 252–253
6,2017,async/await and asyncio in Python 3.6 and beyond,Yury Selivanov,"The talk overviews async/await, asynchronous generators and comprehensions in Python 3.6 and the asyncio module. We'll discuss when and how asyncio should be used in a modern applications and services, what is uvloop, and what asyncio frameworks and libraries one should use. I'll share our ideas about where asyncio is headed and what to expect in Python 3.7.",2017-05-08 13:10:00,Oregon Ballroom 203–204
7,2017,Asynchronous Python for the Complete Beginner,Miguel Grinberg,"With the introduction of the asyncio package in Python 3.4, you can hear lots of people talking about asynchronous programming, most in a favorable way, some not so much. In this talk, I will tell you what this async fever is about and what can it do for you that regular Python can't, not only with asyncio, but also with other frameworks that existed long before it.",2017-05-08 13:50:00,Oregon Ballroom 203–204
8,2017,Automate AWS With Python,Moshe Zadka,"AWS is one of the best-known cloud vendors. Using the Web UI is fine when starting out, but automating cloud operations is important. Boto3 provides a great Pythonic API to AWS, but using it correctly can be subtle.  The talk will cover how to automate AMI builds, building Cloud Formation Templates and automating S3 bucket management.",2017-05-08 10:50:00,Portland Ballroom 252–253
9,2017,Awesome Command Line Tools,Amjith Ramanujam,"Designing a good command line tool is challenging. Command line tools look archaic compared to modern graphical interfaces, discoverability is a big issue for command line tools, proactive help is hard to implement. This talk will cover a set of specific techniques to help alleviate those challenges.  How did pgcli and mycli overcome these problems? We will cover specific examples where command line apps shine. The examples will be drawn from pgcli, mycli and bpython. This talk will suggest libraries and show how they can help you implement a wonderful command line interface.   The libraries covered in this talk include python-prompt-toolkit,  pygments, click, fuzzyfind.  The goal of the talk is to distil the ideas that exist in successful command line applications as guidelines for building powerful command line applications.",2017-05-08 11:30:00,Portland Ballroom 252–253
10,2017,Bayesian Statistical Analysis with Python,Eric J. Ma,"You've got some data, and now you want to analyze it with Python. You're on your way to greatness! Now the problem comes: do I do the t-test? Chi-squared test? How do I decide? In this talk, inspired by many Pythonista Bayesians (@jakevdp, @allendowney, @twiecki, @fonnesbeck) before, I will show you how you can take common statistical decision problems, formulate them as a Bayesian analysis problem, and use PyMC3 as your workhorse tool for gaining insights. This talk will be math-light and code-heavy, and if you download the slides, you'll have a simple template for more complex Bayesian analysis down the road!",2017-05-08 14:30:00,Portland Ballroom 251 & 258
11,2017,"Big picture software testing: unit testing, Lean Startup, and everything in-between",Itamar Turner-Trauring,"There are many ways you can test your software: unit testing, manual testing, end-to-end testing, and so forth. Take a step back and you'll discover even more form of testing, many of them very different in their goals: A/B testing, say, where you see which of two versions of your website results in more signups or ad clicks.  How do these forms of testing differ, how do they relate to each other? How do you choose which kind of testing to pursue, given limited time and resources? How do you deal with strongly held yet opposite views arguing either that a particular kind of testing is essential or that it's a waste time?  This talk will provide you with a model, a way to organize all forms of testing and understand what exactly they provide, and why. Once you understand the model you will be able to choose the right form of testing for your situation and goals.",2017-05-08 11:30:00,Portland Ballroom 252–253
12,2017,"Building A Gigaword Corpus: Lessons on Data Ingestion, Management, and Processing for NLP",Rebecca Bilbro,"As the applications we build are increasingly driven by text, doing data ingestion, management, loading, and preprocessing in a robust, organized, parallel, and memory-safe way can get tricky. This talk walks through the highs (a custom billion-word corpus!), the lows (segfaults, 400 errors, pesky mp3s), and the new Python libraries we built to ingest and preprocess text for machine learning.  While applications like Siri, Cortana, and Alexa may still seem like novelties, language-aware applications are rapidly becoming the new norm. Under the hood, these applications take in text data as input, parse it into composite parts, compute upon those composites, and then recombine them to deliver a meaningful and tailored end result. The best applications use language models trained on domain-specific corpora (collections of related documents containing natural language) that reduce ambiguity and prediction space to make results more intelligible. Here's the catch: these corpora are huge, generally consisting of at least hundreds of gigabytes of data inside of thousands of documents, and often more!  In this talk, we'll see how working with text data is substantially different from working with numeric data, and show that ingesting a raw text corpus in a form that will support the construction of a data product is no trivial task. For instance, when dealing with a text corpus, you have to consider not only how the data comes in (e.g. respecting rate limits, terms of use, etc.), but also where to store the data and how to keep it organized. Because the data comes from the web, it's often unpredictable, containing not only text but audio files, ads, videos, and other kinds of web detritus. Since the datasets are large, you need to anticipate potential performance problems and ensure memory safety through streaming data loading and multiprocessing. Finally, in anticipation of the machine learning components, you have to establish a standardized method of transforming your raw ingested text into a corpus that's ready for computation and modeling.  In this talk, we'll explore many of the challenges we experienced along the way and introduce two Python packages that make this work a bit easier: Baleen and Minke. Baleen is a package for ingesting formal natural language data from the discourse of professional and amateur writers, like bloggers and news outlets, in a categorized fashion. Minke extends Baleen with a library that performs parallel data loading, preprocessing, normalization, and keyphrase extraction to support machine learning on a large-scale custom corpus.",2017-05-08 16:30:00,Portland Ballroom 251 & 258
13,2017,Building Stream Processing Applications,"Amit Ramesh, Qui Nguyen","Do you have a stream of data that you would like to process in real time? There are many components with Python APIs that you can put together to build a stream processing application. We will go through some common design patterns, tradeoffs and available components / frameworks for designing such systems. We will solve an example problem during the presentation to make these points concrete. Much of what will be presented is based on experience gained from building production pipelines for the real-time processing of ad streams at Yelp. This talk will cover topics such as consistency, availability, idempotency, scalability, etc.",2017-05-08 14:30:00,Oregon Ballroom 201–202
14,2017,Community powered packaging: conda-forge,Filipe Pires Alvarenga Fernandes,"The Python scientific community always wanted a package manager that is cross platform, does not require sudo, and lets Python be awesome! The conda package manager solved that problem, but created a new ones...  This talk is a tour disguised as a beginner tutorial to conda-forge packaging. We will try to discuss some myths and misconceptions about conda and conda-forge, as well as a quick comparison with pip and wheels.",2017-05-08 13:55:00,Oregon Ballroom 201–202
15,2017,Constructive Code Review,Erik Rose,"“Your code is bad and you are bad. Have a bad day.” Too many code reviews feel like this, and it saps the enthusiasm that drives open source. Instead, let’s explore how to give reviews that are truthful but encouraging, boosting the skill level of contributors and the quality of the project. We’ll look at “tact hacks” that nudge communication in a friendly direction, antipatterns to avoid, the pesky human emotions that can tempt us into reviewing poorly, and techniques for leveling up newcomers without losing all your coding time.",2017-05-08 15:15:00,Portland Ballroom 254–255
16,2017,Cython as a Game Changer for Efficiency,Alex Orlov,"Are you running a Web application? Do you suffer from CPU bottlenecks that slow down your growth? There's a tool that can easily fix all that, and then some. C++ knowledge not required.  Come learn how Instagram, the world's largest Django deployment with more than 600M active users, saved ~30% of global CPU by rewriting a handful of modules on the critical path in Cython. Learn to apply those techniques to your own projects with little effort and stop worrying about switching to other programming languages or rewriting stable components in C++.",2017-05-08 17:10:00,Portland Ballroom 251 & 258
17,2017,Dask: A Pythonic Distributed Data Science Framework,Matthew Rocklin,"Dask is a general purpose parallel computing system capable of Celery-like task scheduling, Spark-like big data computing, and Numpy/Pandas/Scikit-learn level complex algorithms, written in Pure Python.  Dask has been adopted by the PyData community as a Big Data solution.  This talk focuses on the distributed task scheduler that powers Dask when running on a cluster.  We'll focus on how we built a Big Data computing system using the Python networking stack (Tornado/AsyncIO) in service of its data     science stack (NumPy/Pandas/Scikit Learn).  Additionally we'll talk about the  challenges of effective task scheduling in a data science context (data        locality, resilience, load balancing) and how we manage this dynamically with  aggressive measurement and dynamic scheduling heuristics.",2017-05-08 16:15:00,Portland Ballroom 252–253
18,2017,"Debugging in Python 3.6: Better, Faster, Stronger",Elizaveta Shashkova,"Python 3.6 was released in December of 2016 and it has a lot of new cool features. Some of them are quite easy for using: a developer can read, for example, about f-strings and they can start using them in their programs as soon as possible. But sometimes features are not so evident, and a new frame evaluation API is one of them.  The new frame evaluation API was introduced to CPython in PEP 523 and it allows to specify a per-interpreter function pointer to handle the evaluation of frames. It might not be evident how to use this new feature in everyday life, but it’s quite easy to understand how to build a fast debugger based on it.  In this talk we are going to explain how standard way of debugging in Python works and how a new frame evaluation API may be useful for creating the fast debugger. Also we will consider why such fast debugging was not possible in the previous versions of Python. If someone hasn’t made a final decision to move to Python 3.6 this talk will provide some new reasons to do it.",2017-05-08 10:50:00,Oregon Ballroom 201–202
19,2017,"Decorators, unwrapped: How do they work?",Katie Silverio,"Decorators are a syntactically-pleasing way of modifying the behavior of functions in Python. However, they can be highly opaque to Python beginners. It took me a while to learn how to write one, and even after I was confident writing my own decorators, felt like they were magical. The goal of this talk is to demystify decorators by methodically stepping through how and why they work. Along the way we'll touch on closures, scopes, and how Python is compiled.",2017-05-08 14:35:00,Oregon Ballroom 201–202
20,2017,Designing secure APIs with state machines,"Ashwini Oruganti, Mark Williams","Did you ever need to create an application whose behavior varies with its state, while still presenting a consistent interface to its callers? A good, layered design using state machines can help avoid the tedious 'if' checks for flags, and ensure that if your code runs at all, it will run with all the required values initialized.  I will demonstrate this with examples, and talk about some available tools and libraries to build state machines in Python.        I will also discuss how to effectively use the process of threat modeling to build secure web applications. Threat modeling is a computer security technique that helps you better understand the systems you create, identify attacks, and build defenses. I will talk about things that we, as software developers, can do to assess the security of our applications in the real world through this process.",2017-05-08 14:35:00,Portland Ballroom 251 & 258
21,2017,Dial M For Mentor,Mariatta Wijaya,"One of the nicest things about Python community is the availability of mentors willing to help you. Various mentors have helped me navigate the open source community and help advanced my skills. I realized finding a mentor is not as easy as it seems, and it takes a lot of courage to reach out in the first place. And then, there is impostor syndrome, where one may feel like they don’t deserve the help. In this talk, I will provide advice about working with a mentor. Asking for help is not a failure.",2017-05-08 13:55:00,Portland Ballroom 254–255
22,2017,"Dr. Microservices, Or How I Learned to Stop Worrying and Love the API",Ryan Anguiano,"Assuming that you already know how to build a monolithic app, you must be wondering how you can use all this ""microservice"" stuff that you keep hearing about. Well, a good word of advice is that you probably don't need it. If designed properly, a monolithic app should be able to scale and fit the needs of most businesses. Even so, you should keep your development as simple as possible until you have proven and solidified your business concepts. But if you do need to grow to Internet scale, then you have a long road ahead of you.  Moving from a monolithic application to microservices is a natural evolution that is often of necessity. There are several competing schools of thought that are still being battle-tested in these early days of microservice architecture. Among all the competing paradigms, most of the requirements can be agreed upon, but are mostly differentiated by the tools used to fulfill the requirements.  This talk will cover setting up the required infrastructure, and demonstrate how to migrate a sample monolithic Django application into a microservices platform.  The demo application will use the following technologies: Django, Flask, Fabric, Terraform, Ansible, CentOS, Docker, Mesos, Consul, Nginx, Pgbouncer, Kafka",2017-05-08 14:35:00,Portland Ballroom 252–253
23,2017,Ending Py2/Py3 compatibility in a user friendly manner,"Matthias Bussonnier, Min Ragan-Kelley, M Pacer, Thomas Kluyver","   ""Four shalt thou not count, neither count thou two, excepting that thou   then proceed to three.""           Monty Python and the Holy Grail; Scene 33      Python 3 has been around for more than eight years, and much of the Python ecosystem is now available both on Python 2 and Python 3, often using a single code base. Nonetheless, this compatibility comes at a development cost and some library authors are considering ending support for Python 2 . These once-python-2-compatible libraries are at risk of being upgraded on non compatible system and cause user (and developer) frustration.  While it may seem simple to cease support for Python 2, the challenge is not in ending support, but doing so in a way that does not wreak havoc for users who stay on Python 2. And that is not only a communications problem, but a technical one : up until recently, it was impossible to tag a release as Python 3 only; today it is possible.  Like any maintainer of a widely used library, we want to ensure that users continue to use Python 2 continue to have functioning libraries, even after development proceeds in a way that does not support Python 2.   One approach is to ensure easy installation of older versions if possible avoid incompatible versions altogether. Users should not need to manually pin maximal version dependencies across their development environments and projects if all they want is to use the latest versions of libraries that are compatible with their system.  Even if we did expect that of users, consider what would happen when a package they rely on converts to be only Python 3 compatible. If they were not tracking the complete dependency tree, they might discover, on  upgrade, that their projects no longer work. To avert this they would need to pin those at the last version compatible with Python 2. Users that want to use older python versions should not have to go through so much anguish to do so.   In order to solve this problem, and thereby make both users' and maintainers' lives easier, we ventured into the rabbit-hole called Packaging.  Though we set off with a singular quest, our tale roves through many lands. We'll narrate the story of our amending PEPs, our efforts in building the ramparts of the pypa/Warehouse Castle, battles with the dragons of Pip, and errands in the ""land of no unit tests"" otherwise known as PyPI legacy.  By the end of the above tale, the audience members will know the road to Python 3 only libraries had once had hazards that are now easily avoidable. So long as users upgrade their package management tools.",2017-05-08 15:15:00,Portland
24,2017,Executing python functions in the linux kernel by transpiling to bpf,Alex Gartrell,ebpf is a linux kernel byte-code which can be used for functionality ranging from tracing system calls with kprobe to routing packets with tc.  This talk is about a pure-python front-end for ebpf that allows users to write simple python functions to be executed in the kernel.  I'll first explain how this was made to work and then I'll show off some of the features/capabilities of this approach with working examples.,2017-05-08 15:15:00,Portland Ballroom 254–255
25,2017,Experiment Assignment on the Web,Jessica Stringham,"A popular way of improving websites is to run experiments on it. We split users into groups, show two or more variations of the site, measure how well each one does, and then show the best version to everyone. In this talk, I'll walk through a toy Python program that does the first step: splits users into groups. A few interesting problems arise: grouping users, whitelists, and scaling. I'll share different ways to address them. I'll also give examples of things that can go terribly wrong when designing experiment assignment code.",2017-05-08 10:50:00,Oregon Ballroom 203–204
