id,year,title,presenters,description,talk_dt,location
114,2018,Clearer Code at Scale: Static Types at Zulip and Dropbox,Greg Price,"Python now offers static types! Companies like Dropbox and Facebook, and open-source projects like Zulip, use static types (with PEP 484 and mypy) to make Python more productive and fun to work with — in existing codebases from 40k lines to 4 million, in Python 2 and 3, and while preserving the conciseness and flexibility that make Python a great language in the first place. I’ll describe how.  Reading and understanding code is a huge part of what we do as software developers. If we make it easier to understand our codebases, we make everyone more productive, help each other write fewer bugs, and lower barriers for new contributors. That's why Python now features optional static types, and why Dropbox, Facebook, and Zulip use them on part or all of their Python code.  In this talk, I’ll share lessons from Zulip’s and Dropbox’s experience — having led the mypy team at Dropbox and working now on the Zulip core team — for how you can start using static types in your own codebases, large or small. We’ll discuss how to make it a seamless part of your project’s tooling; what order to approach things in; and powerful new tools that make it even easier today to add static types to your Python codebase than ever before.",2018-03-29 13:50:00,Grand Ballroom B
115,2018,"Code like an accountant: Designing data systems for accuracy, resilience and auditability",Sophie Rapoport,"As engineers, we care a lot about the reliability of our applications. When a website falls over, pagers go off, and engineers burst into action to bring a site back to life.  Postmortems are written, and teams develop strategies to prevent similar failures in the future.  But what about the reliability of our data? Would you trust financial reports built on your data?   If not, what can you do to improve data health? If you would trust these reports, how can you prove to customers, investors, and auditors alike that they should too?  In this talk, you’ll learn to apply strategies from the world of dev-ops to data. You’ll learn about questions auditors ask that can help you pinpoint data problems. You’ll also learn some accounting-specific tools for accurate and timely record keeping that I’ve found fascinating and helpful!",2018-03-29 11:30:00,Global Center Ballroom AB
116,2018,Code Reviews Using Art Critique Principles,Stacy Morse,"Code reviews don't have to be a time consuming, morale zapping, arduous tasks. Not only can they catch bugs and errors but they can contribute in positive ways to the individual developer, the team, management and company as a whole.    Art critiques have existed in academia for hundreds of years. The methodology of the critique has evolved to be time sensitive and productive, while keeping the enthusiasm of the student artist intact.    The purpose of the art critique is to get peers and mentors to look at the work and raise any problems they may see. It's also time where people with more experience could contribute their knowledge in a helpful way. This process is about producing the best work, quickly and in a productive and constructive way.   These methods can be applied to code review.",2018-03-29 10:50:00,Grand Ballroom A
117,2018,Coding through Adversity,Chris Schuhmacher,"In 2017, I was released from prison after serving 17 years. One of the most transformational experiences I had while incarcerated was learning to code, through a pioneering new program called Code.7370 — the first coding curriculum in a United States prison.  In this talk, I’d like to share my experiences learning to code in prison and getting a software engineering job after my release, with the goals of:  Inspiring new programmers to stick with it and be confident in their abilities  Inspiring educators to think about how to support new coders in a broad range of learning environments (there’s no internet in prison!)  Inspiring everyone to think about the potential for rehabilitation in prison in a new way",2018-03-29 10:50:00,Grand Ballroom B
118,2018,Colossal Cave Adventure in Python... in the browser!,Christopher Swenson,"Colossal Cave, also known as Adventure or ADVENT, is the original text adventure. It was written in FORTRAN IV and there is practically no way to run the original program without translating it. We'll explore software archeology to write a Python interpreter to run the FORTRAN code as-is, without translating it. Come learn about pre-ASCII and 36-bit integers and writing interpreters in Python!  And, we'll show how to use BeeWare's Batavia Python interpreter (in JavaScript) to execute the program. FORTRAN IV in Python in JavaScript in your browser!",2018-03-29 12:10:00,Grand Ballroom B
119,2018,Controlling apples with snakes: Automating mobile apps with Appium,Nir Arad,"Testing mobile applications is hard. Testing manually is nearly impossible. That’s where automated testing shines. Just sit back and watch the machine go! Python is a very powerful language for writing automated tests, but since Python is not installed on mobile platforms, we need to find a way to remotely control and monitor the device. But how do we automate a device remotely? The answer is Appium.  In this talk I will go over the process of deploying and testing iOS (or Android) applications, and how to work with Appium to easily generate Python 3 code for testing your application.",2018-03-29 15:15:00,Grand Ballroom A
120,2018,"Counter, Gauge, Upper 90 - Oh my!",Amit Saha,"Setting up application monitoring is often an afterthought, and in the speaker's opinion can be a bit overwhelming to get started with. What is a metric? What is a gauge? What is a counter? What's that upper 90 metric you have up on your dashboard? And what all metrics should I monitor?  This talk aims to get you started on the monitoring journey in Python. In addition to clearing up some of the jargon, we will look at statsd and prometheus monitoring systems and how to integrate our applications with these.  Without the numbers, we are really flying blind!",2018-03-29 11:30:00,Grand Ballroom B
121,2018,CuPy: A NumPy-compatible Library for GPU,Shohei Hido,"Website | Docs | Install Guide | Tutorial | Examples (Official) | Forum  CuPy is an open-source library with NumPy syntax that increases speed by doing matrix operations on NVIDIA GPUs. It is accelerated with the CUDA platform from NVIDIA and also uses CUDA-related libraries, including cuBLAS, cuDNN, cuRAND, cuSOLVER, cuSPARSE, and NCCL, to make full use of the GPU architecture. CuPy's interface is highly compatible with NumPy; in most cases it can be used as a drop-in replacement. CuPy supports various methods, data types, indexing, broadcasting, and more.",2018-03-29 14:35:00,Global Center Ballroom AB
122,2018,Dataclasses:  The code generator to end all code generators,Raymond Hettinger,"The PEP 557 dataclasses module is available in starting in Python 3.7.   It will become an essential part of every Python programmer's toolkit.  This talk shows what problem the module solves, explains its key design decisions, and provides practical examples of how to put it to work.  Dataclasses are shown to be the next step in a progression of data aggregation tools: tuple, dict, simple class, bunch recipe, named tuples, records, attrs, and then dataclasses. Each builds upon the one that came before, adding expressiveness at the expense of complexity.  Dataclasses are unique in that they let you selectively turn-on or turn-off its various capabilities and it lets the user choose the underlying data store (either instance dictionary, instance slots, or an inherited base class).  Dataclasses and typing.NamedTuple both use variable annotations which were new in Python 3.6.",2018-03-29 15:15:00,Grand Ballroom C
123,2018,Data Visualization in Mixed Reality with Python,Anna Nicanorova,"Data Visualization charts are supposed to be our map to information. However, when making charts, customarily we are just re-sizing lines and circles based on metrics instead of creating data-driven version of reality.  The contemporary charting techniques have a few shortcomings (especially when dealing with high-dimensional dataset):    Context Reduction: in order to fit a high-dimensional dataset into a chart one needs to filter/ aggregate/ flatten data which results in reduction of full context of information.  Without context most of the charts show only a part of the story, that can potentially lead to data misinterpretation/misunderstanding.  Numeric Thinking: naturally humans have hard time perceiving big numbers. While data visualization is suppose to help us to conceptualize large volumes,  unless the dataset is carefully prepared, 2D charts rarely give us the intuitive grasp of magnitude.  Perceptual de-humanization: when examining charts it is easy to forget that we are dealing with activity in real world instead of lines/bars.    Augmented/Mixed Reality can potentially solve all of the issues listed above by presenting an intuitive and interactive environment for data exploration. Three dimensional space provides conditions to create complex data stories with more “realistic assets” (beyond lines and bars). The talk would present the architecture required to create MR data visualization story with Python (70% of architecture), starting with drawing 3D assets in a data-driven way and finishing with deployment on MR devices.",2018-03-29 10:50:00,Grand Ballroom B
124,2018,Debugging PySpark -- Or trying to make sense of a JVM stack trace when you were minding your own bus,Holden Karau,"Apache Spark is one of the most popular big data projects, offering greatly improved performance over traditional MapReduce models. Much of Apache Spark’s power comes from lazy evaluation along with intelligent pipelining, which can make debugging more challenging. This talk will examine how to debug Apache Spark applications, the different options for logging in PySpark, as well as some common errors and how to detect them.  Spark’s own internal logging can often be quite verbose, and this talk will examine how to effectively search logs from Apache Spark to spot common problems. In addition to the internal logging, this talk will look at options for logging from within our program itself.  Spark’s accumulators have gotten a bad rap because of how they interact in the event of cache misses or partial recomputes, but this talk will look at how to effectively use Spark’s current accumulators for debugging as well as a look to future for data property type accumulators which may be coming to Spark in future version.  In addition to reading logs, and instrumenting our program with accumulators, Spark’s UI can be of great help for quickly detecting certain types of problems.  Debuggers are a wonderful tool, however when you have 100 computers the “wonder” can be a bit more like “pain”. This talk will look at how to connect remote debuggers, but also remind you that it’s probably not the easiest path forward.",2018-03-29 15:15:00,Grand Ballroom A
125,2018,Democratizing Distributed Computing with Dask and JupyterHub,Matthew Rocklin,"We use JupyterHub, XArray, Dask, and Kubernetes to build a cloud-based system to enable scientists to analyze and manage large datasets.  We use this in practice to serve a broad community of atmospheric and climate scientists.  Atmospheric and climate scientists analyze large volumes of observational and simulated data to better understand our planet.  They have historically used tools like NumPy and SciPy along with Jupyter notebooks to combine efficient computation with accessibility.  However, as datasets increase in size and collaboration extends to new populations of scientists these tools begin to feel their age.  In this talk we use more recent libraries to build a modern deployment for academic scientists.  In particular we use the following tools:   Dask: to parallelize and scale NumPy computations XArray: as a self-discribing data model and tool kit for labeled and index arrays JupyterLab: to enable more APIs for users beyond the classic notebook JupyterHub: to manage users and maintain environments for a new population of cloud-friendly users Kubernetes: to manage everything and deploy easily on cloud hardware   This talk will focus less on how these libraries work and will instead be a case study of using them together in an operational setting.  During the talk we will build up and deploy a running system that the audience can then use to access distributed computing resources.",2018-03-29 10:50:00,Room 26A/B/C
126,2018,Demystifying the Patch Function,Lisa Roach,"One of the most challenging and important thing fors for Python developers learn is the unittest mock library. The patch function is in particular confusing- there are many different ways to use it. Should I use a context manager? Decorator? When would I use it manually? Improperly used patch functions can make unit tests useless, all the while making them look as if they are correctly testing code.Let’s learn how to wield patch with confidence!",2018-03-29 12:10:00,Grand Ballroom B
127,2018,Don't Look Back in Anger: Wildman Whitehouse and the Great Failure of 1858,Lilly Ryan,"In the 1850s, Edward Orange Wildman Whitehouse was appointed the lead engineer of the first attempt to build a trans-Atlantic telegraph cable. With the entire population of two continents waiting for his go-live, their handlebar moustaches aquiver, he demonstrated in fine form just how spectacularly a big project can be a bigger disaster.  This is a tale of long-winded rants, spectacular sideburns, and gentlemen scientists behaving badly. It is also a lesson about the importance of honest reflection in technical teamwork. Lilly outlines some of the mistakes made during one of the biggest tech delivery projects in history, and how a constructive view of failure helped to turn it all around. Through the public meltdowns of Wildman Whitehouse you will learn the importance of feedback, how to handle complex tasks gracefully, and the best way to recover from having your pipeline eaten by a whale.",2018-03-29 13:55:00,Grand Ballroom C
128,2018,DragonPaint – Bootstrapping Small Data to Color Cartoons,Gretchen Greene,"The creation of sufficient quantities of labeled training data is one of the biggest challenges for machine learning applications, especially when the data itself must be created, not just labeled. DragonPaint presents a generalizable strategy for minimizing the manual creation of data using rule based algorithms to automate the creation of a restricted subset of data and then bootstrapping to the automated creation of unrestricted (rule breaking) training and test data. A gentle introduction to computer vision, graphics and machine learning, we use Python and geometry to build an image data set for a TensorFlow model.",2018-03-29 11:30:00,Grand Ballroom B
129,2018,Easy 2D Game Creation With Arcade,Paul Vincent Craven,"Want to have fun with Python? Do something visual? Get started today? Learn how to draw, animate, and use sprites for games with the Python Arcade library.  ""Arcade"" is an easy-to-use Python library for creating 2D arcade games. We'll show you how to get started creating your own game, and find plenty of example code to get an idea of what you can do with this library. If you are familiar with PyGame, Arcade is easier, more powerful, and uses recent Python features like type hinting and decorators.  This talk is great for beginners, educators, and people who want to create their own arcade games.",2018-03-29 14:35:00,Room 26A/B/C
130,2018,Efficient shared memory data structures,Claudio Freire,"Multithreading makes shared memory easy, but true parallelism next to impossible. Multiprocessing gives us true parallelism, but it makes sharing memory very difficult, and high overhead. In this talk, we'll explore techniques to share memory between processes efficiently, with a focus on sharing read-only massive data structures.",2018-03-29 13:10:00,Grand Ballroom B
131,2018,Effortless Logging: A deep dive into the logging module,Mario Corchero,"Logs are our best friend, especially on those late nights when we try to troubleshoot a problem in production that was written by a co-worker who is on vacation. Logs are the main way to know what is happening with an application at runtime, but we don’t realize how important they are until we actually need them. Unfortunately, they are usually an under-estimated part of the development process.  This talk aims to transmit the need for the logging module, briefly explains how to use it and how it is built, and dives into all the complexity that is hidden to us. This will help attendees not just understand all the magic that allows us to inspect our applications at runtime, but also to avoid mistakes and adapt the module to our needs for more esoteric scenarios.  The talk is structured to simplify the understanding of the logging module. Many people have read the documentation, but still struggle to fully understand what is happening under the hood. This talk aims to eliminate that barrier by presenting it in an easier-to-digest manner.",2018-03-29 13:10:00,Room 26A/B/C
132,2018,Elegant Solutions For Everyday Python Problems,Nina Zakharenko,"Are you an intermediate python developer looking to level up? Luckily, python provides us with a unique set of tools to make our code more elegant and readable by providing language features that make your code more intuitive and cut down on repetition. In this talk, I’ll share practical pythonic solutions for supercharging your code.   Specifically, I'll cover:   What magic methods are, and show you how to use them in your own code. When and how to use partial methods. An explanation of ContextManagers and Decorators, as well as multiple techniques for implementing them. How to effectively use NamedTuples, and even subclass and extend them!   Lastly, I'll go over some example code that ties many of these techniques together in a cohesive way. You'll leave this talk feeling confident about using these tools and techniques in your next python project!",2018-03-29 17:10:00,Room 26A/B/C
133,2018,Exploring Deep Learning Framework PyTorch,Stephanie Kim,"Anyone who is interested in deep learning has gotten their hands dirty playing around with Tensorflow, Google's open source deep learning framework. Tensorflow has its benefits like wide scale adoption, deployment on mobile, and support for distributed computing, but it also has a somewhat challenging learning curve, is difficult to debug, and hard to deploy in production. PyTorch is a new deep learning framework that solves a lot of those problems.  PyTorch is only in beta, but users are rapidly adopting this modular deep learning framework. PyTorch supports tensor computation and dynamic computation graphs that allow you to change how the network behaves on the fly unlike static graphs that are used in frameworks such as Tensorflow. PyTorch offers modularity which enhances the ability to debug or see within the network and for many, is more intuitive to learn than Tensorflow.  This talk will objectively look at PyTorch and why it might be the best fit for your deep learning use case and we'll look at use cases that will showcase why you might want consider using Tensorflow instead.",2018-03-29 16:15:00,Grand Ballroom A
134,2018,Fighting Gerrymandering with PyMC3,"Colin Carroll, Karin C. Knudson","At the end of 2017, there were seven states with ongoing redistricting litigation.  We will discuss a statistical model that the United States Supreme Court declared to be appropriate in cases of racial gerrymandering, and show how it can be implemented and used with the library PyMC3.  We will also discuss what the model tells us about racial gerrymandering in North Carolina.",2018-03-29 13:55:00,Grand Ballroom B
135,2018,Fighting the Good Fight: Python 3 in your organization,Jason Fried,"Today, services built on Python 3.6.3 are widely used at Facebook. But as recently as May of 2014 it was actually impossible at all to use Python 3 at Facebook. Come learn how we cut the Gordian Knot of dependencies and social aversion to the point where new services are now being written in Python 3 while older Python 2 projects are actively migrated to Python 3. All accomplished by a small group of individual contributors in their spare time. Learn to fight the good fight and upgrade your organization to Python 3 like we did at Facebook.",2018-03-29 16:30:00,Grand Ballroom B
136,2018,Flourishing FLOSS: Making Your Project Successful,Anna Ossowski,"You maintain an Open Source project with great code? Yet your project isn’t succeeding in the ways you want? Maybe you’re struggling with funding or documentation? Or you just can’t find new contributors and you’re drowning in issues and pull requests? Open Source is made up of many components and we are often better-trained in methods for writing good code, than in methods for succeeding in the other dimensions we want our project to grow.  In this talk we’ll explore the different components of an Open Source project and how they work together. After this talk you’ll be well-equipped with a ideas and strategies for growing, cultivating, and nourishing your Open Source project.   For your project to succeed, all of its non-code components must be well-maintained. What are these different components and what methods can we learn to maintain them?   Build real relationships with your sponsors and determine ways how both sides can benefit from this relationship, don’t just ask people for money.  Establish a good communication system with your contributors: Keep them informed, listen to their feedback and input, make them feel heard.  Thank the people who worked on ticket triage or marketing, not just those who wrote code, in your release notes.  Make it easy for new contributors to get started: Write and maintain good documentation, answer questions in a friendly and timely manner.  Market and evangelize in the right places and at the right time: Give conference talks, organize sprints, keep your project’s Twitter account active, always curate new and interesting content on your blog or website. Implement a Code of Conduct and enforce it if needed: Make your project a safe space to contribute for everyone.    With these methods and a half-dozen others, you’ll handle beautifully all the components your project needs to succeed.",2018-03-29 13:55:00,Grand Ballroom B
137,2018,"Get your resources faster, with importlib.resources",Barry Warsaw,"Resources are files that live within Python packages.  Think test data files, certificates, templates, translation catalogs, and other static files you want to access from Python code.  Sometimes you put these static files in a package directory within your source tree, and then locate them by importing the package and using its __file__ attribute.  But this doesn't work for zip files!  You could use pkg_resources, an API that comes with setuptools and hides the differences between files on the file system and files in a zip file.  This is great because you don't have to use __file__, but it's not so great because pkg_resources is a big library and can have potentially severe performance problems, even at import time.  Welcome to importlib.resources, a new module and API in Python 3.7 that is also available as a standalone library for older versions of Python.  importlib.resources is build on top of Python's existing import system, so it is very efficient.  It also defines an abstract base class which loaders can implement to provide their own resource access.  Python's built-in zipimporter uses this to provide efficient access to resources within a zip file.  Third party import hooks can do the same, so resources can come from anything that is importable by Python.  This talk will step through the motivations behind importlib.resources, the library's usage, its interfaces, and the hooks made available to third party packages.  It will also talk about the minor differences between the standalone version and the version in Python 3.7's standard library.  Hopefully audience members will come away with compelling reasons to port their code to this much more efficient library.",2018-03-29 17:10:00,Grand Ballroom C
138,2018,Graph Databases: Talking about your Data Relationships with Python,Nicolle Cysneiros,"Have you ever considered how many relationships you have in your virtual life? Every friend or page liked on Facebook, each connection in LinkedIn or Twitter account followed is a new relationship not only between two people, but also between their data. In Brazil only, we have 160 millions Facebook users. How can we represent and manipulate all these relationships? Graph Databases are storage systems that use graph structure (nodes and edges) to represent and store data in a semantic way.  This talk will begin approaching the challenge in representing relationships in Relational Databases and introducing a more friendly solution using graph. The definition of Graph Database, its pros and cons and some available tools (Neo4J, OrientDB and TitanDB) will be shown during the presentation, as well as how these tools can be integrated with Python.",2018-03-29 13:40:00,Grand Ballroom A
