id,year,title,presenters,description,talk_dt,location
83,2017,The Python Visualization Landscape,Jake VanderPlas,"So you want to visualize some data in Python: which library do you choose? From Matplotlib to Seaborn to Bokeh to Plotly, Python has a range of mature tools to create beautiful visualizations, each with their own strengths and weaknesses. In this talk I’ll give an overview of the landscape of dataviz tools in Python, as well as some deeper dives into a few, so that you can intelligently choose which library to turn to for any given visualization task.",2017-05-08 16:30:00,Portland Ballroom 252–253
84,2017,The trends in choosing licenses in Python ecosystem,Anwesha Das,"The software licenses are the permissions over copyrighted software. The permission and/ grant includes the grant to use, to redistribute, to prepare derivative works etc. These software licenses also set forth the limitations over these aforesaid rights. The software licenses basically marks the boundary for the usage of the code.  Therefore from the above mentioned introduction it very clear that it is very important for developers to choose the license for their code wisely and correctly.  PyPI, the Python Package Index is a repository of software for the Python programming language. There are currently 80000+ packages there.  This talk will go through the licenses of the top 2500 packages. We will see the trend of choosing a license for these top Python projects. We will discuss the licenses individually, compare them with each other. the advantages and disadvantages of the same.  We will further explain that why a license and/or licenses are being favored by the developers.",2017-05-08 10:50:00,Portland Ballroom 254–255
85,2017,The Wild West of Data Wrangling,Sarah Guido,"Data science introductory courses might give you the impression that dealing with data is neat, tidy, and simple. They present you with a simplistic dataset and the scikit-learn or Pandas documentation, and a day or so later, you're done! Piece of cake, right?  The real world of data isn't that easy!   As a data scientist who has worked in the industry for several years, I have had a lot of experience dealing with messy, inaccurate, incomplete data, and I want to share those experiences with you. I'll talk my way through three real-world situations where I've had to analyze and build models on untidy and complex data, going through how I've preprocessed the data and prepared it for modeling. You'll leave with an understanding of how a data scientist thinks about data and what she does when the data is complicated.",2017-05-08 17:10:00,Portland Ballroom 254–255
86,2017,Title Available On Request: An Introduction to Lazy Evaluation,Joe Jevnik,"Lazy evaluation, also known as ""call by need"", is an evaluation strategy where values are produced only when needed. Lazy evaluation is the opposite of eager evaluation, Python's normal evaluation model, where functions are executed as seen and values are produced immediately.  In this talk we will define lazy evaluation and contrast it with eager evaluation. We will discuss tools that exist in Python for using lazy evaluation and show how we can build on the primitives to better represent computations. We will introduce common vocabulary for discussing evaluation models, and compare different systems for implementing lazy evaluation. Finally, we will discuss optimizations that can be made to optimize lazily evaluated expressions.",2017-05-08 10:50:00,Portland Ballroom 254–255
87,2017,"Tracing, Fast and Slow: Digging into and improving your web service’s performance",Lynn Root,"Do you maintain a Rube Goldberg-like service? Perhaps it’s highly distributed? Or you recently walked onto a team with an unfamiliar codebase? Have you noticed your service responds slower than molasses? This talk will walk you through how to pinpoint bottlenecks, approaches and tools to make improvements, and make you seem like the hero! All in a day’s work.  The talk will describe various types of tracing a web service, including black & white box tracing, tracing distributed systems, as well as various tools and external services available to measure performance. I’ll also present a few different rabbit holes to dive into when trying to improve your service’s performance.",2017-05-08 17:10:00,Oregon Ballroom 201–202
88,2017,Type uWSGI; press enter; what happens?,"Asheesh Laroia, Philip James","You're a pretty knowledgeable Python web application developer, but how does that web application get served to the world? For many of us, uWSGI is the magic that makes our application available, and in this talk we'll look at how uWSGI works with the OS and the networking stack to make the magic happen.",2017-05-08 11:30:00,Oregon Ballroom 203–204
89,2017,Unicode: what is the big deal?,Łukasz Langa,"Ever wondered why people complain that text processing is a hard problem? Or why Python 3 would introduce such a big backward incompatibility with switching to Unicode? Wonder no more, this talk is for you.  In 30 minutes I'm going to demonstrate real world text processing problems and how Python 3 helps solve them. The talk is going to explain how you should split your text from binary data in your application, what are sensible defaults and what are possible gotchas. All this sprinkled with a healthy dose of frustration by a guy whose first name starts with Ł.",2017-05-08 17:10:00,Portland Ballroom 254–255
90,2017,Web identity: OAuth2 and OpenIDConnect,Brendan McCollam,"Interested in adding single sign-on to your application, but confused about the variety of different web authentication methods out there? OAuth, OAuth2, OpenID, OpenIDConnect, SAML, Facebook Connect? This talk will clarify the different protocols, examining OAuth2 and OpenIDConnect in greater detail. It will demonstrate a basic client implementation using FLOSS libraries, and briefly touch on some of the issues involved in server implementation.",2017-05-08 12:10:00,Oregon Ballroom 203–204
91,2017,What's in your pip toolbox?,Jon Banafato,"pip is a great tool, but dependency management doesn't stop there. I'll explore several tools that work with pip to make managing your dependencies easier, faster, and safer. I'll cover generating dependencies a better way, maintaining your requirements.txt for the long-term, and exploring existing Python environments. Afterward, you'll never want to pip freeze > requirements.txt again.",2017-05-08 15:15:00,Oregon Ballroom 203–204
92,2017,What's new in Python 3.6,Brett Cannon,"Python 3.6 has turned out to be quite the release! With 16 Python Enhancement Proposals incorporated into the version, Python 3.6 is only surpassed by Python 3.0 for having more PEPs included in a single release. This talk will be an overview of those 16 PEPs and other changes outlined in the What's New document for Python 3.6.",2017-05-08 12:10:00,Oregon Ballroom 203–204
93,2017,When the abyss gazes back: staring down Python's surprising internals,David Wolever,"Python's fantastic until it isn't.  This talk dives into some of the surprising implementation details of CPython, then explains exactly how they could be discovered from first principles.    Attendees will leave with some dangerous Python trivia, and the tools they'll need to uncovery their own trivia when surprises strike.  The talk takes a deep dive into a StackOverflow question asking why ""x"" in (""x"", ) is faster than ""x"" == ""x"" (http://stackoverflow.com/questions/28885132/why-is-x-in-x-faster-than-x-x/28885213#28885213), including a discussion of dis.disassemble, the Pyhton stack machine, and reading the CPython source. If time permits, there will be other fun examples, a whirlwind tour of debugging, and a couple of homework assignments.",2017-05-08 11:30:00,Portland Ballroom 251 & 258
94,2017,Writing a C Python extension in 2017,Jean-Baptiste Aviat,"This talk describes the build of a C Python extension, with prebuilt binaries, in 2017, where modern packaging standards, as well as Docker, have been a game changer in the Python extensions world. Most examples come from our experience building PyMiniRacer, an embedded Python / JavaScript bridge used in production across hundreds of companies.  We will describe the different aspects of building a binary extension, including:   using the modern manylinux wheel type in order to ship a built binary, usable in most Linux distributions; the choices offered to developers when building an extension: the Python public C API, cffi, ...; testing of a binary module across various platforms; troubleshooting & debugging an extension: the basics you need to tackle most common issues.",2017-05-08 16:30:00,Portland Ballroom 251 & 258
95,2017,"Yes, It's Time to Learn Regular Expressions",Al Sweigart,"Regular expressions have a reputation as opaque and inscrutable. However, the basic concepts behind ""regex"" and text pattern recognition are simple to grasp. This talk is for any programmer who isn't familiar with Python's re module and its best practices. Stop putting it off, it's time to learn regular expressions!",2017-05-08 16:30:00,Oregon Ballroom 203–204
96,2018,A Bit about Bytes: Understanding Python Bytecode,James Bennett,"At some point every Python programmer sees Python bytecode files -- they're those '.pyc' files Python likes to leave behind after it runs. But have you ever wondered what's really going on in those files? Well, wonder no more! In this talk you'll learn what Python bytecode is and how it's used to execute your code, as well as how to decipher and read it, and how to reason about bytecode to understand the performance of your Python code.",2018-03-28 17:10:00,Grand Ballroom B
97,2018,Adapting from Spark to Dask: what to expect,Irina Truong,"Until very recently, Apache Spark has been a de facto standard choice of a framework for batch data processing. For Python developers, diving into Spark is challenging, because it requires learning the Java infrastructure, memory management, configuration management. The multiple layers of indirection also make it harder to debug things, especially when throwing the Pyspark wrapper into the equation.  With Dask emerging as a pure Python framework for parallel computing, Python developers might be looking at it with new hope, wondering if it might work for them in place of Spark. In this talk, I’m using a data aggregation example to highlight the important differences between the two frameworks, and make it clear how involved the switch may be.  Note: Just in case it's unclear, there's no Java of any kind in this talk. All the code / examples use Python (PySpark).",2018-03-29 14:35:00,Grand Ballroom A
98,2018,All in the timing: How side channel attacks work,"Philip James, Asheesh Laroia","In this talk, you’ll learn about a category of security issue known as side channel attacks. You’ll be amused to see how features like automatic data compression, short-circuit execution, and deterministic hashing can be abused to bypass security systems. No security background knowledge is required. The talk assumes at least intermediate Python experience.  We’ll take a tour of real side channel vulnerabilities in open source Python codebases, including the patches that fixed them. It also offers practical advice for avoiding these issues. My goal is to demystify this topic, even if you aren’t writing security-critical software.",2018-03-29 17:10:00,Grand Ballroom B
99,2018,Analyzing Data: What pandas and SQL Taught Me About Taking an Average,Alex Petralia,"“So tell me,” my manager said, “what is an average?”  There’s probably nothing worse than that sinking feeling when you finish an analysis, email it to your manager or client to review, and they point out a mistake so basic you can’t even fathom how you missed it.   This talk is about mine: how to take an average.  Averages are something we use everywhere - it’s a simple np.mean() in pandas or AVG() in SQL. But recently I’ve come to appreciate just how easy it is to calculate this statistic incorrectly. We learn once - in middle school no less - how to take an average, and never revisit it. Then, when we are faced with multidimensional datasets (ie. pretty much every dataset out there), we never reconsider whether we should be taking an average the same way.  In this talk, we follow my arduous and humbling journey of learning how to properly take an average with multidimensional data. We will cover how improperly calculating it can produce grossly incorrect figures, which can slip into publications, research analyses and management reports.",2018-03-29 15:15:00,Global Center Ballroom AB
100,2018,A practical guide to Singular Value Decomposition in Python,Daniel Pyrathon,"Recommender systems have become increasingly popular in recent years, and are used by some of the largest websites in the world to predict the likelihood of a user taking an action on an item. In the world of Netflix, this means recommending similar movies to the ones you have seen. In the world of dating, this means suggesting matches similar to people you already showed interest in!  My path to recommenders has been an unusual one: from a Software Engineer to working on matching algorithms at a dating company, with a little background on machine learning. With my knowledge of Python and the use of basic SVD (Singular Value Decomposition) frameworks, I was able to understand SVDs from a practical standpoint of what you can do with them, instead of focusing on the science.  In my talk, you will learn 2 practical ways of generating recommendations using SVDs: matrix factorization and item similarity. We will be learning the high-level components of SVD the ""doer way"": we will be implementing a simple movie recommendation engine with the help of Jupiter notebooks, the MovieLens database, and the Surprise recommendation package.",2018-03-29 13:50:00,Room 26A/B/C
101,2018,Augmenting Human Decision Making with Data Science,Kelsey Pedersen,"Do we even need humans? Humans and data science are flawed on their own. Humans lack the ability to process large volumes of information. Machines lack intuition, empathy, and nuance. You'll learn how to guide users of expert-use systems by applying data science to their user experience. This allows us to take advantage of the human-touch while leveraging our large datasets. What is the relationship between human decisions and algorithms? Are we thinking about data science all wrong? In this talk, you'll learn the ways we balance human decisions and data science throughout our applications, the challenges we have faced along the way and the future of the relationship between humans and data.",2018-03-29 11:30:00,Grand Ballroom A
102,2018,Automating Code Quality,Kyle Knapp,"Writing quality Python code can be both tough and tedious. On top of the general design, there are many code quality aspects that you need to watch out for when writing and reviewing code such as adherence to PEP8, docstring quality, test quality, etc. Furthermore, everyone is human. If you are catching these code quality issues by hand, there is a good chance that at some point you will miss an easy opportunity to improve code quality. If the quality check can be done by a machine, then why would you even try to catch the code quality issue by hand? In the end, the machine will be able to perform the quality check with much more speed, accuracy, and consistency than a person.  This talk will dive into how existing open source projects offload and automate many of these code quality checks resulting in:   A higher quality and a more consistent codebase Maintainers being able to focus more on the higher level design and interfaces of a project. An improved contribution process and higher quality pull requests from external contributors   By diving into how these open source projects automate code quality checks, you will learn about:   The available tooling related to checking code quality such as flake8, pylint, coverage, etc. How to automate code quality checks for both a development and team  setting. First-hand accounts of the benefits and lessons learned from automating code quality checks in real-life open source projects.",2018-03-29 14:30:00,Grand Ballroom A
103,2018,Bayesian Non-parametric Models for Data Science using PyMC3,Christopher Fonnesbeck,"Nowadays, there are many ways of building data science models using Python, including statistical and machine learning methods. I will introduce probabilistic models, which use Bayesian statistical methods to quantify all aspects of uncertainty relevant to your problem, and provide inferences in simple, interpretable terms using probabilities.  A particularly flexible form of probabilistic models uses Bayesian non-parametric methods, which allow models to vary in complexity depending on how much data are available. In doing so, they avoid the over-fitting that is common in machine learning and statistical modeling. I will demonstrate the basics of Bayesian non-parametric modeling in Python, using the PyMC3 package. Specifically, I will introduce two common types, Gaussian processes and Dirichlet processes, and show how they can be applied easily to real-world problems using two examples.",2018-03-29 13:40:00,Global Center Ballroom AB
104,2018,Behavior-Driven Python,Andrew Knight,"Behavior-Driven Development (BDD) is gaining popularity as an improved way to collaborate over product features and tests. In Python, behave is one of the leading BDD test frameworks. Using behave, teams write Gherkin behavior scenarios (e.g., tests) in plain language, and then programmers write Python code to automate the steps. BDD testing is great because tests are self-documenting and steps abide by the DRY principle. An example test could be:     Given the DuckDuckGo home page is displayed   When the user searches the phrase ""Python""   Then search results for ""Python"" are shown   This talk will teach how to use behave to develop well-designed test scenarios and a robust automation framework. It will focus on the layers of the behave framework: feature files, step definitions, support classes, and config files. A full example project will be hosted on GitHub for audience members to reference after the talk.",2018-03-29 12:10:00,Grand Ballroom A
105,2018,Beyond scraping: how to use machine learning when you're not sure where to start,Julie Lavoie,"Scraping one web site for information is easy, scraping 10000 different sites is hard. Beyond page-specific scraping, how do you build a program than can extract the publication date of (almost) any news article online, no matter the web site?  We’ll cover when to use machine learning vs. humans or heuristics for data extraction, the different steps of how to phrase the problem in terms of machine learning, including feature selection on HTML documents, and issues that arise when turning research into production code.",2018-03-29 14:35:00,Grand Ballroom B
106,2018,Beyond Unit Tests: Taking Your Testing to the Next Level,Hillel Wayne,"You've used pytest and you've used mypy, but bugs are still slipping through your code. What's next? In this talk, we cover two simple but powerful tools for keeping your code problem-free. Property-based testing, provided by the Hypothesis library, lets you run hundreds of tests from a single template. Contracts, via dpcontracts, make your program test itself. You'll learn how and why to use these tools and how to combine them with the rest of your testing suite.",2018-03-29 12:10:00,Room 26A/B/C
107,2018,Big-O: How Code Slows as Data Grows,Ned Batchelder,"Big-O is a computer science technique for analyzing how code performs as data gets larger.  It's a very handy tool for the working programmer, but it's often shrouded in off-putting mathematics.  In this talk, I'll teach you what you need to know about Big-O, and how to use it to keep your programs running well.  Big-O helps you choose the data structures and algorithms that will let your code work efficiently even on large data sets.  You can understand Big-O even if you aren't a theoretical computer science math nerd. Big-O isn't as mystical as it appears. It's wrapped in mathematical trappings, but doesn't have to be more than a common-sense assessment of how your code will behave.",2018-03-29 14:30:00,Grand Ballroom C
108,2018,Birding with Python and Machine Learning,Kirk Kaiser,"In the past few years, the power of computer vision has exploded. In this talk, we'll apply a deep learning model to a bird feeder. We'll use that model to detect, identify, and record birds that come to a smart bird feeder.  Along the way, we'll learn about different platforms to deploy deep learning cameras on, from the lowly Raspberry PI all the way up to the powerful NVIDIA Jetson embedded computer with a built in GPU.",2018-03-29 14:35:00,Grand Ballroom C
109,2018,Bowerbirds of Technology: Architecture and Teams at Less-than-Google Scale,Sam Kitajima-Kimbrel,"Facebook, Google, Uber, LinkedIn, and friends are the rarefied heights of software engineering. They encounter and solve problems at scales shared by few others, and as a result, their priorities in production engineering and architecture are just a bit different from the rest of us down here in the other 99% of services. Through deconstructing a few blog posts from these giants, we’ll evaluate just what is it that they’re thinking about when they build systems and whether any of their choices are relevant to those of us operating at high scale yet still something less than millions of requests per second.  This talk will go into depth on how to make technological decisions to meet your customers’ requirements without requiring a small army of engineers to answer 2 AM pages, and how to set realistic goals for your team around operations, uptime, communications, and disaster recovery.  With these guidelines in mind, you should be better equipped to say no (or yes!) the next time your team’s software hipster proposes moving everything to the Next Big Thing.",2018-03-29 17:10:00,Global Center Ballroom AB
110,2018,Building a cross-platform native app with BeeWare,Russell Keith-Magee,"Have you ever wanted to write a GUI application you can run on your laptop? What about an app that you can run on your phone? Historically, these have been difficult to achieve with Python, and impossible to achieve without learning a different API for each platform. But no more.  BeeWare is a collection of tools and libraries that allows you to build cross-platform native GUI applications in pure Python, targeting desktop, mobile and web platforms. In this talk, you'll be introduced to the BeeWare suite of tools and libraries, and see how you can use them to develop, from scratch, a GUI ChatBot application that can be deployed as a standalone desktop application, a mobile phone application, and a single page webapp - without making any changes to the application's codebase.",2018-03-29 14:35:00,Grand Ballroom C
111,2018,Building a Data Pipeline with Testing in Mind,Jiaqi Liu,"It’s one thing to build a robust data pipeline process in python but a whole other challenge to find tooling and build out the framework that allows for testing a data process. In order to truly iterate and develop a codebase, one has to be able to confidently test during the development process and monitor the production system.   In this talk, I hope to address the key components for building out end to end testing for data pipelines by borrowing concepts from how we test python web services. Just like how we want to check for healthy status codes from our API responses, we want to be able to check that a pipeline is working as expected given the correct inputs. We’ll talk about key features that allows a data pipeline to be easily testable and how to identify timeseries metrics that can be used to monitor the health of a data pipeline.",2018-03-29 16:30:00,Room 26A/B/C
112,2018,Build Teams as an Engineer,Joyce Jang,"We build product and software as teams. And as anyone who as worked on a team knows, there’s often a lot more that goes into working together to build that product than actually just building the product itself. A highly functional team is not as elusive it may seem. Software engineering is a skill we’ve developed, but even more importantly software engineering on teams is another skill we’ve been practicing and improving on as an industry. Software engineering principles and best practices may seem to have very little to do with teamwork, but being able to thoughtfully apply some of what we’ve learned as engineers towards teamwork, we can help move towards creating such success with our teams.",2018-03-29 10:50:00,Grand Ballroom C
113,2018,By the Numbers: Python Community Trends in 2017/2018,"Dmitry Filippov, Ewa Jodlowska","Want to know about the latest trends in the Python community and see the the big picture of how things have changed over the last few years? Interested in the results of the latest official Python Developers Survey 2017 which was supported by the Python Software Foundation and gathered responses from more than 10.000 Python developers? Come learn about the most popular types of Python development, trending frameworks, libraries and tools, additional languages being used by Python developers, Python versions usage statistics and many other insights from the world of Python. All derived from the actual data and professional research such as the Python Developers Survey 2017 which collected responses from over 10.000 Python developers, organized in partnership between the Python Software Foundation and JetBrains, the Python Developers Survey 2016, 3rd party surveys and supplementary analytical research.",2018-03-29 13:55:00,Room 26A/B/C
