id,year,title,presenters,description,talk_dt,location
55,2017,One Data Pipeline to Rule Them All,Sam Kitajima-Kimbrel,"There are myriad data storage systems available for every use case imaginable, but letting application teams choose storage engines independently can lead to duplicated efforts and wheel reinvention. This talk will explore how to build a reusable data pipeline based on Kafka to support multiple applications, datasets, and use cases including archival, warehousing and analytics, stream and batch processing, and low-latency ""hot"" storage.",2017-05-08 13:50:00,Oregon Ballroom 201–202
56,2017,Optimizations which made Python 3.6 faster than Python 3.5,Victor Stinner,"Various optimizations made Python 3.6 faster than Python 3.5. Let's see in detail what was done and how.  Python 3.6 is faster than any other Python version on many benchmarks. We will see results of the Python benchmark suite on Python 2.7, 3.5 and 3.6.  The bytecode format and instructions to call functions were redesign to run bytecode faster.  A new C calling convention, called ""fast call"", was introduced to avoid temporary tuple and dict. The way Python parses arguments was also optimized using a new internal cache.  Operations on bytes and encodes like UTF-8 were optimized a lot thanks to a new API to create bytes objects. The API allows very efficient optimizations and reduces memory reallocations.  Some parts of asyncio were rewritten in C to speedup code up to 25%. The PyMem_Malloc() function now also uses the fast pymalloc allocator also giving tiny speedup for free.  Finally, we will see optimization projects for Python 3.7: use fast calls in more cases, speed up method calls, a cache on opcodes, a cache on global variables.",2017-05-08 10:50:00,Portland Ballroom 251 & 258
57,2017,Packaging Let’s Encrypt: Lessons learned shipping Python code to hundreds of thousands of users,Noah Swartz,"Let's Encrypt launhced on April 12th 2016, for the first time allowing anyone access to free SSL certificates that could be automatically fetched and renewed. The demand was massive, and so was the need for a client to fetch these certificates for all of those users. This client is called Certbot, and it's written entirely in Python. Unfortunately for the sanity of Certbot developers, these users of Let's Encrypt can't decide on a single operating system to use! This requires us to ship our software, and all of its dependencies, to a variety of systems all with different web servers, Python versions, package managers,and underlying packages. Learn how we got through this mess!",2017-05-08 13:55:00,Portland Ballroom 251 & 258
58,2017,Passing Exceptions 101: Paradigms in Error Handling,Amandine Lee,"Exception handling in Python can sometimes feel like a Wild West. If you have a send_email function, and the caller inputs an invalid email address, should it: A) Return None or some other special return value, B) Let the underlying exception it might cause bubble up, C) Check via a regex and type checking and raise a ValueError immediately, or D) Make a custom EmailException subclass and raise that?   What if there is a network error while the email was sending? Or what if the function calls a helper _format_email that returns an integer (clearly wrong!), or raises an TypeError itself? Should it crash the program or prompt a retry?   This talk will introduce the concept of an exception, explain the built-in Python exception hierarchy and the utility of custom subclasses, demonstrate try/except/finally/else syntax, and then explore different design patterns for exception control flow and their tradeoffs using examples. It will also make comparisons to error handling philosophy in other languages, like Eiffel and Go.",2017-05-08 11:30:00,Oregon Ballroom 201–202
59,2017,Piecing it Together: A beginner's guide to application configuration,Mary Nagle,"Assembling all the necessary setup for an application you’re building can often be more frustrating than writing the app itself. Learning to do this well is difficult, especially for those who are new to Python and might not know where to begin or what questions to ask. While there is no “right way” to set up a development environment or application, understanding the components involved and how they interact can empower you to customize your setup to best suit your needs. This talk will dive into what happens when setting up a database, the purpose and configuration of an isolated environment, how Python packages are installed, and finally, how each of these components interact with each other and the application itself; in particular, how an application's structure facilitates said interactions.",2017-05-08 13:10:00,Portland Ballroom 254–255
60,2017,Prehistoric Patterns in Python,Lennart Regebro,"Why do some code use dictionaries that have None for all values? Is it true that you shouldn't concatenate strings with +? Will Python optimize constant calculations?  This talk will go through some patterns that used to be common in Python, but which now are regarded as outdated and see if they really are outdated and why. The results surprised me, maybe they'll surprise you.",2017-05-08 11:30:00,Portland Ballroom 251 & 258
61,2017,Probabilistic Programming with PyMC3,Christopher Fonnesbeck,"Bayesian statistics offers robust and flexible methods for data analysis that, because they are based on probability models, have the added benefit of being readily interpretable by non-statisticians. Until recently, however, the implementation of Bayesian models has been prohibitively complex for use by most analysts. But, the advent of probabilistic programming has served to abstract the complexity of Bayesian statistics, making such methods more broadly available. PyMC3 is a open-source Python module for probabilistic programming that implements several modern, computationally-intensive statistical algorithms for fitting Bayesian models, including Hamiltonian Monte Carlo (HMC) and variational inference. PyMC3’s intuitive syntax is helpful for new users, and the reliance on Theano for much of the computational work has allowed developers to keep the code base simple, making it easy to extend the software to meet analytic needs. PyMC3 itself extends Python's powerful ""scientific stack"" of development tools, which provide fast and efficient data structures, parallel processing, and interfaces for describing statistical models.  ",2017-05-08 13:10:00,Portland Ballroom 251 & 258
62,2017,Python for mathematical visualization: a four-dimensional case study,David Dumas,"This is a talk about creating pictures of a mathematical object---specifically, a 4-dimensional fractal ""dust"" that has been the subject of mathematical research in hyperbolic geometry since the 1980s.  In the end this is accomplished using a little algebra, a little geometry, and a healthy dose of Python.  That is, I will present a case study of using Python in several aspects of a mathematical visualization project, from the computation itself, to transforming and converting data, and finally for scripting the process of generating the images.  Along the way I'll explain how Python's convenient idioms and containers (e.g. sets and set comprehensions) are a good fit for some of the algebraic and geometric questions that come up, how Scipy and Numpy enable fast numerical calculations, and how Python's strength as a language for scripting and automation allows easy orchestration of rendering of still images and frames of animations.  The mathematical visualization project we describe is a collaboration with François Guéritaud (Université de Lille).",2017-05-08 17:10:00,Portland Ballroom 252–253
63,2017,Python from Space: Analyzing Open Satellite Imagery Using the Python Ecosystem,Katherine Scott,"Earth imaging satellites, just like our computers, are shrinking and becoming more ubiquitous than ever before. It is now possible to obtain open satellite data on a daily if not weekly basis and for this data to be put to work; helping us better understand our planet and quickly respond to disaster situations.   In this talk we will work through a jupyter notebook that covers the satellite data ecosystem and the python tools that can be used to sift through and analyze that data. Topics include python tools for using Open Street Maps data, the Geospatial Data Abstraction Library (GDAL), and OpenCV and NumPy for image processing. This talk is intended for novice and intermediate python developers who are interested in using data science and satellite imagery for social good and fundamental scientific research.",2017-05-08 15:15:00,Oregon Ballroom 201–202
64,2017,Python in The Serverless Era,Benny Bauer,"Serverless is the latest phase in the evolution of cloud development. Its building blocks are functions, a bunch of stateless “nano-services”, that can scale automatically and charged only when used. It enables teams to focus more on development while having fully managed servers. In this talk I'll cover the Serverless Architectures practices, use cases, tooling and the role python plays in it.",2017-05-08 13:50:00,Portland Ballroom 254–255
65,2017,Rants and Ruminations From A Job Applicant After 💯 CS Job Interviews in Silicon Valley,Susan Tan,"What is it like to interview at 1 technology company? Stressful and tiring. What is it like to interview at 100 technology companies? I have done that. In late August 2016, I quit an uninspiring full-time software job and talked to 100 employers in the San Francisco Bay Area to find the best fit. The hiring process reflects the company culture and its values. Listen to my rants and ruminations of interviewing at tiny seed-stage startups to large technology companies in Silicon Valley. Learn how to reform your own hiring process to be more considerate and thoughtful. Learn how to prepare for interviews efficiently.",2017-05-08 14:35:00,Portland Ballroom 254–255
66,2017,Readability Counts,Trey Hunner,"Have you found unreadable PEP8-compliant code and wondered how to fix it?  Have you ever seen code that was simply a pleasure to read?  If you've ever wondered what makes code easy to read, this talk is for you.  During this talk we'll learn a number of techniques for refactoring code to improve readability and maintainability.  We'll discuss:   whitespace self-documenting code modularity expectation management   We'll end with a checklist for improving the readability of your own code.",2017-05-08 11:30:00,Oregon Ballroom 201–202
67,2017,Re-Programming the Human Genome with Python,Riley Doyle,"Modern genome editing techniques such as CRISPR-Cas9 are revolutionizing the way we discover and treat the root genetic causes of disease. Many of the most popular tools and libraries in this cutting edge application are written in Python. This talk will provide a general, software-centric introduction to the exciting new area of genome editing, describe the central string search, machine learning, and data management problems involved, and review how Python frameworks and libraries are used today to solve these problems in Production in order to benefit human health. This talk assumes no prior lab experience: only a proficiency with Python and curiosity!",2017-05-08 16:30:00,Portland Ballroom 254–255
68,2017,Requests Under The Hood,Cory Benfield,"Requests is widely acknowledged as a library that saves users an enormous amount of time, effort, and pain through its intuitive and clear API. For this reason, most people who have never looked at the code assume that its code is as intuitive, well-structured, and clear as the API.  Of course, the truth is more complex than that. Real software that deals with real problems is rarely ideal: there are edge cases, terrible hacks, and awkward workarounds for problems.  Often in the software industry we pretend that these imperfections in our software don’t exist, or we try to hide them. These imperfections frequently cause people to reinvent wheels in order to simplify the code, which has benefits for understandability but frequently has downsides for resilience. When people talk about “battle-tested” code, they mean code that has been dirtied up over time from its original Platonic ideal implementation to something that is just as complex and warty as real life.  In this talk, one of the Requests and urllib3 core maintainers lays bare all of the worst and hackiest corners of the codebases of these two libraries. The goal is to help expose all of the invisible work done in mature codebases to tolerate edge cases and misbehaviour, as well as to try to remind us all that the perfect is the enemy of the good.",2017-05-08 10:50:00,Oregon Ballroom 201–202
69,2017,Share Your Code! Python Packaging Without Complication,Dave Forgac,"If you want people to use your code you should package it! You may have heard that packaging is hard but the Python packaging ecosystem has evolved a lot over the years. Taking your beautiful code and sharing it with the world is complex but it doesn't have to be complicated. In this talk you will learn how to take advantage of modern tooling and practices so you can get boring stuff out of the way, publish quickly and frequently, and focus on your code.  This talk will cover:   A (brief) history of Python packaging Python Packaging User Guide recommendations Distribution formats Anatomy of a package Automating package creation Adding: Testing CI Documentation Testing package installation Releasing to PyPI   This talk is for you if you're new to Python packaging and would like to learn how to share you code or if you've worked with Python for a while and just aren't up-to-date with the latest packaging practices.",2017-05-08 13:10:00,Oregon Ballroom 201–202
70,2017,Slot or not: higher performance custom objects in pure Python,Aaron Hall,"__slots__ are versatile for certain kinds of uses and users, if you know how they work.   At first glance, they seem like a free lunch, with improvements in both time and space. At second glance, they seem to have so many caveats to make them not worth using.   This talk is a deep dive into how __slots__ work, how to wring every benefit out, as well as the actual caveats and alternatives, with recommendations for writers of core libraries as well as end users.",2017-05-08 16:30:00,Portland Ballroom 254–255
71,2017,Snakes on a Hyperplane: Python Machine Learning in Production,Jessica Lundin,"Companies with an artificial-intelligence plan have a differentiating strategy in the intelligence economy; however, implementing robust machine-learning in production is nontrivial, often requiring a close collaboration between data scientists and developers, and retooling the production stack and workflows to develop and maintain accurate models.    Machine learning in production involves model application, handling missing data, data artifacts, and data outside of the training calibration.  A rigorous evaluation framework draws upon logging to determine characteristics of model coverage, model performance, auditing, and run-time performance.  Model coverage includes the number of times the model produced sensible output relative to number of times it is called.  Model coverage is reduced if the model does not converge or model criteria are not met.  Model performance is evaluated with a suite of metrics (accuracy, AUC, FPR, TPR, RMSE, MAPE, etc.), which assist in determining the most appropriate model to use in the production scenario and the validity of the model training.  Regularly performing manual audits for spot checks is important for debugging and ensuring the model passes sanity checks.  Model performance includes run times and profiling model pieces, ensuring performance is within specified requirements and refactoring otherwise.  In the AI renaissance, where ML is a critical piece of intelligent products, seamlessly integrating model evaluation into workflows is an important component of making robust products and building a satisfying customer experience.  Python is a great language to build intelligent products with its abundance of ML libraries and wrappers contributed as open-source software in addition to rich full-stack capabilities.",2017-05-08 17:10:00,Oregon Ballroom 203–204
72,2017,Snek in the Browser,Katie McLaughlin,"Python is a decades-strong language with a large community, and it has a solid foundation on the server, but it doesn't have a good user story in the browser... until now.  The BeeWare project aims to bring Python natively, everywhere. Using a combination of the Batavia and Toga projects, we can develop and entirely native web experience in Python, no JavaScript required.  During this talk, you will learn about how the BeeWare project has built Batavia, a Python virtual machine in JavaScript; and Toga, a multi-platform native API wrapper; a combination of which can be used to build an entire web platform in Python only.",2017-05-08 14:35:00,Portland Ballroom 251 & 258
73,2017,Solid Snakes or: How to Take 5 Weeks of Vacation,Hynek Schlawack,"No matter whether you run a web app, search for gravitational waves, or maintain a backup script: being responsible for a piece of software or infrastructure means that you either get a pager right away, or that you get angry calls from people affected by outages.  Being paged at 4am in everyday life is bad enough.  Having to fix problems from hotel rooms while your travel buddies go for brunch is even worse.  And while incidents can’t be prevented completely, there are ways to make your systems more reliable and minimize the need for (your!) manual intervention.  This talk will help you to get calm nights and relaxing vacations by teaching you some of them.",2017-05-08 13:40:00,Portland Ballroom 252–253
74,2017,Static Types for Python,"Jukka Lehtosalo, David Fisher","Over the past year and a half, Dropbox has been investing in the development of mypy, a static type checker for Python, as a way to make our multimillion-line Python codebase easier to understand, navigate, and maintain.  In this talk, we will discuss the benefits of type annotations, explain how to use them, and give a peak into how mypy works behind the scenes.  Mypy is an open-source type-checker for Python which supports the PEP 484 standard for gradual typing. Originally created by Jukka Lehtosalo as part of his PhD thesis in 2013, it is now under active development by a small team at Dropbox which includes David Fisher, Greg Price, and Guido van Rossum.  It supports Python 3.2 and higher, as well as Python 2.7 (via type comments).",2017-05-08 12:10:00,Oregon Ballroom 201–202
75,2017,Temporal Data Structures with SQLAlchemy and Postgres,Joseph Leingang,"SQLAlchemy (http://www.sqlalchemy.org) and Postgres (https://www.postgresql.org) provide several useful tools that allow us to build and query records through time: temporal models. Combining a need to have robust auditing, as well feature development on per-property history, we can turn “regulatory overhead” into an exciting technical challenge. At Clover Health we have built a small library to automate the task of decorating a model and making it “temporal.” This talk aims to demonstrate the underlying data model and interface for building this system.",2017-05-08 11:30:00,Oregon Ballroom 203–204
76,2017,Text is More Complicated Than You Think: Comparing and Sorting Unicode,Morgan Wahl,"Few people realize just how complicated text can be. Did you know sorting and even case-folding can depend on a user's locale? That different strings of characters can be semantically completely equivalent? That there are over a thousand Latin letters?  Legacy text encodings like ASCII made a lot of simplifying assumptions about how written languages work, and we all put up with them because it was cool to even have computers in the first place. Unicode removes many of those assumptions and provides the tools we need to write software that can just do the right thing regardless of what text users throw at it. Even if you don't translate your UI, getting the details of string comparison, sorting, and searching right can eliminate annoying surprises for you and your users.",2017-05-08 13:40:00,Oregon Ballroom 203–204
77,2017,The Dictionary Even Mightier,Brandon Rhodes,"Since my “Mighty Dictionary” talk at PyCon 2010, the Python dictionary has evolved dramatically. Come learn about all of the the improvements, up to and including the re-architecture that has just landed with Python 3.6! The talk will discuss iterable views, the dictionary’s dedicated comprehension syntax, random key ordering, the special key-sharing dictionary designed to underlie object collections, and, most famously of all, the new “compact dictionary” that cuts dictionary storage substantially — and carries a fascinating side-effect.  Each new feature that the talk discusses will be motivated by considering the trade-offs inherent in hash table data structure design, and followed up with hints about how you can now use the dictionary even more effectively in your own code!",2017-05-08 15:15:00,Oregon Ballroom 201–202
78,2017,The Fastest FizzBuzz in the West: Make Your Own Language with RPLY and RPython,Dustin Ingram,"In this talk, you'll learn how I built DIVSPL (Dustin Ingram's Very Special Programming Language), a tongue-in-cheek domain-specific language, which is particularly good for implementing FizzBuzz -- as quickly as possible.  We'll build DIVSPL with RPLY, an implementation of David Beazley's PLY (but with a ""cooler"" API) and make it compatible with RPython, a restricted subset of the Python programming language. Along the way, you'll learn about lexers, parsers, and grammars, and in the end, you'll know how to build your own language.",2017-05-08 14:35:00,Portland Ballroom 254–255
79,2017,The Gilectomy: How's It Going?,Larry Hastings,"One of the most interesting projects in Python today is Larry Hastings' ""Gilectomy"" project: the removal of Python's Global Interpreter Lock, or ""GIL"".  Come for an up-to-the-minute status report: what's been tried, what has and hasn't worked, and what performance is like now.",2017-05-08 12:10:00,Portland Ballroom 251 & 258
80,2017,The Glory of pdb's set_trace,Nicole Zuckerman,"Everyone needs to debug code, and it can take up a non-trivial portion of our time to wait for code to complete execution and write print messages to stdout. There’s one function in particular in the python debugger (pdb) library that can give you a much clearer understanding of what’s going on in your code, much more quickly; pdb.set_ trace().  In this talk, we’ll identify the most useful things you can do when you use set trace, that can make debugging exponentially more efficient and enjoyable.",2017-05-08 16:30:00,Oregon Ballroom 201–202
81,2017,The Memory Chronicles: A Tale of Two Pythons,Kavya Joshi,"MicroPython is the leanest, meanest full Python implementation. Designed for microcontrollers, this variant of Python runs in less than 300KB of memory, and retains support for all your favorite Python features.   So what does it take to make the smallest Python? Put differently, why does CPython have a large memory footprint?  This talk will explore the internals of MicroPython and contrast it with CPython, focusing on the aspects that relate to memory use. We will delve into the Python object models in each and the machinery for managing them. We will touch upon how the designs of the bytecode compiler and interpreter of each differ and why that matters.",2017-05-08 10:50:00,Portland Ballroom 251 & 258
82,2017,The Next Step: Finding Model Parameters With Random Walks,Christine Waigl,"The statistician John Tukey -- who designed the box plot and coined the term ""bit"" -- wrote:  ""An approximate answer to the right problem is worth a good deal more than an exact answer to an approximate problem"". Python has become one of the major languages for statistical data analysis, not least because of the expressiveness of the language itself and the availability of tools like Jupyter Notebooks, which enable iterative reasoning about a problem and its solutions.   This talks takes one step beyond an introduction to statistics with Python and aims to familiarize the audience with two concepts: a class of problems (so-called inverse problems), and a powerful statistical tool (the random walk, or more formally Markov-Chain Monte Carlo (MCMC) sampling with the Metropolis algorithm).   In inverse problems, model parameters are estimated from observational data. Both model and data are expected to be affected by error. The objective is not only to find parameters that best describe the observations, but also to figure out how good, or how possibly bad, a solution might be. Inverse problems are extremely common in many fields and crop up each time we attempt to reconstruct a reality from sensor, radar, scattering or imaging data.   The Metropololis-Hastings algorithm offers a solution via random sampling of a Bayesian posterior distribution. Even though listed as one of the 20th century's top 10 algorithms by the journal Computing in Science & Engineering, the Metropolis algorithm is easy to understand and implement, and a fun and instructive way to explore even complicated multi-variate probability distributions. ",2017-05-08 13:50:00,Portland Ballroom 251 & 258
